{"inputHash":"aaaaaaaaaaaaaaaaaaaaaaaaaaaaaaaaaaaaaaaaaaaaaaaaaaaaaaaaaaaaaaaa","kind":"geometry_authoring_handoff","maximumDisplacement":2,"members":[{"buffer":0,"editable":true,"lod":0,"memberId":"lod:0/mesh:0/buffer:0","mesh":0,"positions":[["00000000","00000000","00000000"],["0000803f","00000000","00000000"],["00000000","0000803f","00000000"],["0000803f","0000803f","00000000"],["00000000","0000803f","00000000"]],"protectedIds":[0],"sourceDecodedHash":"bbbbbbbbbbbbbbbbbbbbbbbbbbbbbbbbbbbbbbbbbbbbbbbbbbbbbbbbbbbbbbbb","triangles":[0,1,2,1,3,2,2,4,3]},{"buffer":0,"editable":true,"lod":1,"memberId":"lod:1/mesh:1/buffer:0","mesh":1,"positions":[["00000000","00000000","00000000"],["0000803f","00000000","00000000"],["00000000","0000803f","00000000"],["0000803f","0000803f","00000000"],["00000000","0000803f","00000000"]],"protectedIds":[0],"sourceDecodedHash":"bbbbbbbbbbbbbbbbbbbbbbbbbbbbbbbbbbbbbbbbbbbbbbbbbbbbbbbbbbbbbbbb","triangles":[0,1,2,1,3,2,2,4,3]},{"buffer":1,"editable":false,"lod":0,"memberId":"lod:0/mesh:0/buffer:1","mesh":0,"positions":[["00000000","00000000","00000000"],["0000803f","00000000","00000000"],["00000000","0000803f","00000000"],["0000803f","0000803f","00000000"],["00000000","0000803f","00000000"]],"protectedIds":[0,1,2,3,4],"sourceDecodedHash":"bbbbbbbbbbbbbbbbbbbbbbbbbbbbbbbbbbbbbbbbbbbbbbbbbbbbbbbbbbbbbbbb","triangles":[0,1,2,1,3,2,2,4,3]}],"omittedAttributes":["rig","uv","weights","materials","packedFrames"],"requiredLods":[0,1],"schemaVersion":1,"snapshotSha256":"cccccccccccccccccccccccccccccccccccccccccccccccccccccccccccccccc"}